[
 {"protocol":"U-Time","version":"2.0.0","specStatus":"STANDARDIZATION_CANDIDATE","kind":"instant","quantity":"coordinate_time","status":"CALCULATED","quality":"REFERENCE","value":{"d1":2451545.0,"d2":0.0,"scale":"TT","frame":"GCRS"},"uncertainty":{"seconds":0},"provenance":[{"source":"IAU/J2000 convention"}],"algorithm":"identity","validity":null,"observer":null,"referenceData":null,"transformChain":[]},
 {"protocol":"U-Time","version":"2.0.0","specStatus":"STANDARDIZATION_CANDIDATE","kind":"model_result","quantity":"mars_heliocentric_position","status":"MODELED","quality":"APPROXIMATE","value":{"x":1.0,"y":0.0,"z":0.0},"context":{"model":"JPL_APPROXIMATE"},"uncertainty":null,"provenance":[{"source":"JPL Approximate Positions of the Planets"}],"algorithm":"Keplerian Table 1","validity":{"from":"1800-01-01","through":"2050-01-01"},"observer":null,"referenceData":{"source":"JPL Horizons benchmark"},"transformChain":[]},
 {"protocol":"U-Time","version":"2.0.0","specStatus":"STANDARDIZATION_CANDIDATE","kind":"inference","quantity":"age_of_universe","status":"INFERRED","quality":"REFERENCE","value":{"gyr":13.8},"context":{"model":"flat-lcdm"},"uncertainty":{"gyr":0.02},"provenance":[{"source":"cosmology posterior"}],"algorithm":"Friedmann age integral","validity":null,"observer":null,"referenceData":{"source":"DESI/Planck"},"transformChain":[]}
]
